{
  "schema_version": 1,
  "dictionary_version": "v0001",
  "previous_version": null,
  "created_at": "2026-10-28T07:00:00+00:00",
  "colors": {
    "블랙": {
      "color": "black",
      "basis": "approved_jev",
      "approved_run_id": "collection-20261025-01",
      "approved_bundle_sha256": "0000000000000000000000000000000000000000000000000000000000000000",
      "approved_at": "2026-10-28T06:00:00+00:00"
    },
    "오트밀": {
      "color": "beige",
      "basis": "human_decision",
      "approved_run_id": "collection-20261025-01",
      "approved_bundle_sha256": "0000000000000000000000000000000000000000000000000000000000000000",
      "approved_at": "2026-10-28T06:00:00+00:00"
    }
  }
}
